id_service,description,title,codeService
459,Low debate group enter everyone poor loss represent. Your art author certain.,Full-Service Event Management,S459
46,Activity indicate place. Stuff today rock visit she Congress base.,Lighting Design Services,S46
460,Stay off season material. Thank market plant painting policy.,Luxury Wedding Planning,S460
461,Physical join increase age evidence.,Event Budget Management,S461
462,Forget certain put where dark water father.,Event Promotion & Marketing,S462
463,Subject rock do car business opportunity.,Event Compliance & Permits,S463
464,Project brother ability generation. Coach according tonight by.,Sports Event Organization,S464
465,Trade meeting interesting strong threat design inside write.,Sustainable Event Management,S465
466,Player me list agent much just. Myself seat power everyone voice former serve.,Unspecified,S466
467,Drop give film maintain short use day.,Event Photography Services,S467
468,Politics source ask stock eye chance. Choose agreement authority give more boy.,Risk Management for Events,S468
469,Field bring member speak back environment identify.,Risk Management for Events,S469
47,Role surface central bill commercial else. Behavior help assume bad.,Supplier Coordination Service,S47
470,Prepare fill by clear young certain begin. Feel term detail today PM.,RSVP Management Service,S470
471,Result player public. Six mind hour. Food enjoy poor follow name agreement.,Conference Management Service,S471
472,Outside study option morning last. Find mention down.,Private Party Planning,S472
473,Wife less model still assume throw second. Lawyer head participant person.,Opening Ceremony Management,S473
474,Add body direction anything light. Four purpose huge catch international him.,Guest Registration Management,S474
475,Law player thank page choice me blue prove. Whether without out allow store.,Event Photography Services,S475
476,Race industry financial still kind trip. Cup economic cut who best off.,Award Ceremony Management,S476
477,Picture everybody character way. Take management work better president.,Event Decoration & Design,S477
478,Continue carry grow course might. Though cost always affect month least.,Workshop Planning Service,S478
479,Institution sell couple which more. Compare understand capital rich.,Event Crisis Management,S479
48,They suggest popular soon. Recent peace family face current parent.,Unspecified,S48
480,Others worry level week few other after. Break seven usually newspaper already.,Corporate Seminar Organization,S480
481,Set edge they sure save future us what.,Concert Event Management,S481
482,Who fire summer check. Prove tree memory whatever would miss.,Event Content Production,S482
483,American others field. Employee two ground establish base. Back anyone charge.,Festival Planning & Coordination,S483
484,Official perform four sure another never. Home best play. Baby need drug.,Tech Conference Management,S484
485,Subject everything meeting begin skill win member.,Annual General Meeting Management,S485
486,Why wall hot physical loss project outside.,Catering Coordination Service,S486
487,Dream painting hold. Tell class your send. Car rock can hit challenge.,Team Building Event Planning,S487
488,Result create chair beautiful improve.,On-Site Event Coordination,S488
489,Them management appear assume.,Cultural Event Coordination,S489
49,Attention party science someone change management.,Unspecified,S49
490,Personal arrive sometimes class your road attention.,Lighting Design Services,S490
491,Point part like resource. Source southern maintain change as much performance.,Unspecified,S491
492,New few surface part catch interview. Interest court beautiful edge.,Unspecified,S492
493,Present media under both of population.,Green Event Planning,S493
494,Thought air they huge single language others.,Networking Cocktail Events,S494
495,National soon bank little such goal success.,Concert Event Management,S495
496,Why late organization vote best name management. I Mrs research other.,Virtual Event Production,S496
497,These wind fine else money. Son matter past minute front learn.,Festival Planning & Coordination,S497
498,Service without back better. World big inside middle rich.,Guest Registration Management,S498
499,Size food class approach unit on send. Offer energy society then song.,Unspecified,S499
5,Third kid might send TV list control. Ahead structure available party.,Signage & Wayfinding Solutions,S5
50,Sell there third last effect great. As because fund soon network certainly.,Risk Management for Events,S50
500,Group certain long his attorney each page happen. Party choose course data buy.,Festival Planning & Coordination,S500
501,Left buy detail brother. Report politics executive enough hand.,Event Compliance & Permits,S501
502,Cell foot care hour behind hundred majority.,Catering Coordination Service,S502
503,Firm something artist. Wife employee east senior purpose occur.,Festival Planning & Coordination,S503
504,Have live too. Pretty yet think take race between protect hospital.,Venue Selection & Booking,S504
505,Total future attack Congress conference parent.,Unspecified,S505
506,Step section want. Statement something care benefit.,Charity Event Organization,S506
507,Parent party late book kitchen movement. Bring right able reveal.,Live Streaming Event Services,S507
508,Low without argue decide throughout cover with.,Event Scheduling & Planning,S508
509,Newspaper statement country series. Also away environmental six than begin.,Brand Activation Events,S509
51,Player investment either sport. Trial speak finish military small.,Corporate Seminar Organization,S51
510,Leader middle whose catch consider design. Term second along exist.,Exhibition Management Service,S510
511,Side him protect official. President in poor responsibility play watch wonder.,Corporate Training Events,S511
512,Course interest believe vote few. By street already discover.,After-Event Cleanup Coordination,S512
513,Pattern stuff bar ahead evidence case lawyer.,Event Budget Management,S513
514,Fear local production itself score. Special job ok ability be.,Luxury Event Planning,S514
515,Rate huge through show simply serve fill. Design near list and.,Guest Experience Optimization,S515
516,Seek same make since mother others. Indicate ok other house.,Green Event Planning,S516
517,Decide form pay worry thus someone. Member maintain site cup daughter win firm.,VIP Guest Handling Service,S517
518,Begin condition group operation. Movement dark chance strong.,Corporate Training Events,S518
519,Building government indeed common former charge.,Educational Event Planning,S519
52,Between production nice few difference figure. Behavior mouth effort.,Tech Conference Management,S52
520,Cause he picture husband occur stuff. Author region interesting go.,Stage Design & Setup,S520
521,Ten interesting news knowledge rich yet for.,Unspecified,S521
522,Cause expect wear issue time. Consider work fly. Human two face establish.,RSVP Management Service,S522
523,Couple article simple. Scene not impact water world. Ground arm ready easy.,Press Conference Management,S523
524,Of control third marriage. Instead lose room child record.,Hybrid Event Management,S524
525,Kitchen with for sense laugh low final. Write television oil likely husband.,Networking Cocktail Events,S525
526,Better back range either. Need resource necessary analysis throughout.,Event Transportation Management,S526
527,Happy purpose miss teacher question. But article win different specific threat.,Destination Event Management,S527
528,Huge chair citizen best statement. Return too network amount some.,Workshop Planning Service,S528
529,Event point discussion central. Resource several choice science sort.,Event Transportation Management,S529
53,Job others hope boy stand. Talk possible happy huge.,Event Ticketing Management,S53
530,Will several whether month among us magazine score.,Event Decoration & Design,S530
531,Collection girl forget story say. Age best room form interest.,Community Event Management,S531
532,Actually town big. Religious budget forget personal big hospital beyond.,Trade Show Organization,S532
533,Blue mean turn smile agree evening. Down still simple already art more degree.,Unspecified,S533
534,Contain compare hot feel picture. Enjoy bag treat weight eat.,Corporate Event Planning,S534
535,Finally car firm that they religious open music.,Press Conference Management,S535
536,To structure recognize response year phone.,Venue Selection & Booking,S536
537,Be institution husband first traditional thing recognize.,Employee Engagement Events,S537
538,Program top quality ability trouble. Top from soldier right oil.,Event Budget Management,S538
539,Life standard state rock. Year hospital guess realize which.,Luxury Event Planning,S539
54,Task ten manager evidence court bar. This already their PM just whether.,Stage Design & Setup,S54
540,Young raise month another whole offer successful. Various process myself face.,Catering Coordination Service,S540
541,East player dinner down beat. True anything here table science spring improve.,Startup Pitch Event Organization,S541
542,Pm term carry bit tax again enjoy. Add my success he whatever near through.,After-Event Cleanup Coordination,S542
543,Pay become drug need. Method spend perform another can.,Event Photography Services,S543
544,These write today serious position beautiful strategy.,Signage & Wayfinding Solutions,S544
545,Cold summer sometimes leave relationship.,Green Event Planning,S545
546,Whether memory assume resource.,Virtual Event Production,S546
547,Relationship cover sit rich thousand among car. Thing live thank blood.,Event Insurance Coordination,S547
548,Democratic road simply some movie.,Indoor Event Planning,S548
549,Decision stock technology poor meeting build describe.,VIP Guest Handling Service,S549
55,Make four once human without character.,After-Event Cleanup Coordination,S55
550,Add there article type bad. Whatever many draw billion question.,Luxury Event Planning,S550
551,Here quickly pretty act side lay whose. Space family expert left.,Unspecified,S551
552,Your time technology unit. Truth prepare another live stand.,Private Party Planning,S552
553,Network state safe land color former. Meet process task good new true yourself.,Charity Event Organization,S553
554,Focus management activity make international kitchen language cover.,Supplier Coordination Service,S554
555,Heart method Republican record provide growth.,Cultural Event Coordination,S555
556,Good yourself option amount involve reason morning.,Startup Pitch Event Organization,S556
557,Another rock they significant lot not card serve.,Wedding Coordination Service,S557
558,Recognize you control focus rich scientist.,Event Promotion & Marketing,S558
559,Create benefit system realize. Grow beat so save late or.,Audio & Visual Setup Service,S559
56,Wait particularly television sound computer.,Sustainable Event Management,S56
560,Various down religious particularly kid moment relate.,After-Event Cleanup Coordination,S560
561,Song human north many particular matter science.,Event Compliance & Permits,S561
562,Interesting ground study sign begin. Nation level good response scene.,Team Building Event Planning,S562
563,Eight stay study professor yard. House serious expert deal.,Event Promotion & Marketing,S563
564,Tax conference however soon. Interest blue serve decision.,Stage Design & Setup,S564
565,By Democrat although analysis another soldier old. Site situation show.,Luxury Event Planning,S565
566,May matter detail consumer. Six I southern person himself example knowledge.,Unspecified,S566
567,Candidate public response live process state. North theory note national.,Product Demonstration Events,S567
568,Character wrong example. Use else capital stand we including involve.,Cultural Event Coordination,S568
569,Choose really argue. Know mouth student energy off view lawyer society.,Award Ceremony Management,S569
57,Seat leg design determine raise former. Impact often seek study find teacher.,Event Ticketing Management,S57
570,Sport spring authority rather. Eat edge space audience everyone bag.,Live Streaming Event Services,S570
571,Project scientist almost I allow others.,Educational Event Planning,S571
572,Get lawyer management. House off reality might form significant wrong.,Community Event Management,S572
573,Tell compare brother wind most policy. Debate reflect score cup hot executive.,Event Budget Management,S573
574,Require cause option myself to design.,Unspecified,S574
575,Do might community image. Professor best night or officer cell outside argue.,Event Security Management,S575
576,The per how other. Help avoid sister despite.,Corporate Training Events,S576
577,Prevent two feel something mother think ground including.,Custom Event Concept Design,S577
578,Baby bar official himself trip. Poor bag animal full up.,Event Decoration & Design,S578
579,Some speak action against center truth material.,Unspecified,S579
58,Culture become food clearly. Practice world president rich crime real.,RSVP Management Service,S58
580,Positive nothing front forward after. Either until election professor fine.,Sound System Management,S580
581,Room major wind. Within maybe guy especially. Care choose social factor occur.,Event Decoration & Design,S581
582,Traditional statement wall position.,Lighting Design Services,S582
583,Statement compare both form various treatment next.,Full-Service Event Management,S583
584,Near little material bag. Remain chair every article. Believe marriage lawyer.,Event Content Production,S584
585,But feeling student. American bed soon once major box.,Closing Ceremony Organization,S585
586,Sure choice you reach question between decide another.,Educational Event Planning,S586
587,Article card cause bill idea. Natural life deep rest want three edge.,Unspecified,S587
588,Month such sign blood. Work billion its very stuff.,Wedding Coordination Service,S588
589,Exactly impact better so represent every. Note stop house mean wall.,Green Event Planning,S589
59,Available language center great. Her parent everyone carry clear.,Tech Conference Management,S59
590,Outside believe cup statement tend easy.,Corporate Networking Events,S590
591,Letter thousand across full eye occur if certain.,Guest Experience Optimization,S591
592,Ago way thus different four. Tax strong example benefit center five rock.,Community Event Management,S592
593,Fill figure body camera red company.,Event Performance Analysis,S593
594,Us in opportunity event enough skill camera. Nation game five marriage focus.,Signage & Wayfinding Solutions,S594
595,Form which old move amount campaign expert.,Event Videography Services,S595
596,Record life necessary. Catch industry machine garden.,Unspecified,S596
597,Court window shoulder yeah. Two serious news realize amount reveal.,Event Staffing Management,S597
598,Every ahead life lose middle. Song safe federal describe east respond per.,Event Performance Analysis,S598
599,Media prepare suddenly spend program yes economic bag.,Indoor Event Planning,S599
6,Anyone point accept environment year. Lawyer community learn his ago upon at.,Opening Ceremony Management,S6
60,Democratic seek medical woman speak.,On-Site Event Coordination,S60
600,Never police cost. Name town show evening when. Camera sometimes year provide.,Sustainable Event Management,S600
601,Friend and finally piece. Next or increase he reflect many.,Lighting Design Services,S601
602,Road color whom candidate research book idea body. Man or building seat.,Green Event Planning,S602
603,Wait onto candidate country vote situation leader.,Press Conference Management,S603
604,Shoulder minute have range go. Scene life international reflect.,Unspecified,S604
605,How real miss ready. Beat life perhaps board.,VIP Event Management,S605
606,Do car push drop goal away measure move.,Corporate Seminar Organization,S606
607,Drop amount value picture executive. Receive west believe authority.,Signage & Wayfinding Solutions,S607
608,Dinner cut less painting eight. Week age people process.,Exhibition Management Service,S608
609,Threat life finally recognize Republican decide. Hold building beyond per.,Unspecified,S609
61,Senior author hit know protect visit able. Center call vote.,Guest Experience Optimization,S61
610,Kitchen whole add federal. Music hard treat direction other add cover.,Unspecified,S610
611,Official fill each. Identify media report send few most however.,Cultural Event Coordination,S611
612,Shoulder best within bank must life.,Event Videography Services,S612
613,Quality reflect situation throughout during something over.,Sound System Management,S613
614,Together recently crime. Wrong walk time herself.,Festival Planning & Coordination,S614
615,Bring medical financial try why sign. Paper represent reach city.,VIP Guest Handling Service,S615
616,Least day agree player out. Mission government reason determine sport serious.,Roadshow Event Organization,S616
617,Near candidate meeting. Move degree American color wear.,Unspecified,S617
618,Manager key professor could step recent teacher whether. Woman any these.,Unspecified,S618
619,Onto whose price shoulder ten condition good final. Miss country represent.,Workshop Planning Service,S619
62,Certainly successful account list between similar fight.,Hybrid Event Management,S62
620,Much away hit mission them hard.,Virtual Event Production,S620
621,Executive American into control return hope find. Wind politics thank third.,Product Launch Organization,S621
622,Case rock person. Near in lose. Play leg ability hand join marriage close.,Event Photography Services,S622
623,Crime wife mouth recently may produce nature game.,Custom Event Concept Design,S623
624,Thought president American girl always four.,Unspecified,S624
625,Two child subject age. Management structure dream operation his into star.,Corporate Event Planning,S625
626,Never fish window project interview. Home energy far into civil pick.,Unspecified,S626
627,Campaign manager might program between in they local. Size indicate soldier.,Audio & Visual Setup Service,S627
628,Laugh mention daughter similar special. Recent stage voice political.,Conference Management Service,S628
629,Job build light law. Consider behind see money.,Networking Cocktail Events,S629
63,Worry fish whom environment lose water. Soldier industry now.,Charity Event Organization,S63
630,Argue believe without know. Individual couple season.,Cultural Event Coordination,S630
631,Director hair can food white reach thing. Check general region.,Roadshow Event Organization,S631
632,Ground sell owner fire term. Fire short owner century soon power.,Product Demonstration Events,S632
633,Deep move free much likely. Prepare bill describe safe free father.,Unspecified,S633
634,Father who town create. Life actually nothing.,Post-Event Reporting & Analysis,S634
635,Direction occur sing who friend. Dinner begin skin air movie speech citizen.,Event Videography Services,S635
636,Bag all under policy find drug age. Evidence show choose under talk.,Opening Ceremony Management,S636
637,Alone in always everyone job century cover quality.,VIP Event Management,S637
638,White central who financial assume grow.,Roadshow Event Organization,S638
639,Blue pull physical. Soldier blood end occur field establish part.,Custom Event Concept Design,S639
64,Final drive even policy expect. Draw various big today discussion real far.,Unspecified,S64
640,Control language win. Can every participant true seat suddenly.,Concert Event Management,S640
641,Six inside Mrs land fire. Back likely really ten.,Event Videography Services,S641
642,Visit see lay letter new ahead yet husband.,Cultural Event Coordination,S642
643,Concern development just tonight inside like.,Community Event Management,S643
644,Than population kind federal music writer administration two.,Lighting Design Services,S644
645,Such likely decide stock recent capital author.,Unspecified,S645
646,Their from among already college health.,Catering Coordination Service,S646
647,Window organization population phone now put television.,Event Content Production,S647
648,Myself stay shake easy herself wife. Him step wrong guy charge sit.,Host & MC Coordination,S648
649,Remember life wait myself. International senior surface.,Press Conference Management,S649
65,Price company about nothing recently whether. Each mouth music none military.,Unspecified,S65
650,Any executive husband fill by author take. Leg lot truth bed some office.,Corporate Training Events,S650
651,Away collection site piece win PM concern compare.,Indoor Event Planning,S651
652,Feel authority item water hope her. Look program computer outside.,Stage Design & Setup,S652
653,Government speech most use enter them. Already return gun author return answer.,Hybrid Event Management,S653
654,Particularly hospital dark bill house school success. Trip check nor term one.,Corporate Training Events,S654
655,Simple past most late feel participant street. Player college hold keep.,RSVP Management Service,S655
656,Try about authority military crime possible argue.,Product Demonstration Events,S656
657,Sometimes than pick process billion take.,Unspecified,S657
658,Light defense make our. Mission alone pay learn.,Outdoor Event Management,S658
659,Appear save ok live government religious staff. Ago face laugh education.,Wedding Coordination Service,S659
66,Gun easy develop second.,Trade Show Organization,S66
660,Discuss join edge. Road rock rock catch cold give.,Roadshow Event Organization,S660
661,Scientist effect start upon.,Event Crisis Management,S661
662,Soon manage service ever. White least it cause citizen exactly over number.,On-Site Event Coordination,S662
663,Western sign food type company step.,VIP Guest Handling Service,S663
664,Material beautiful old east spend discussion.,Outdoor Event Management,S664
665,Girl better manager reach require item drug. Energy reduce look join son dark.,Lighting Design Services,S665
666,Try agent cause. Cut watch our. Foot south but director role.,Concert Event Management,S666
667,Wait green myself central age strong. Hospital blood last view.,Post-Event Reporting & Analysis,S667
668,Interest series phone close. Close sound thought here.,Product Launch Organization,S668
669,Factor somebody consumer agent ground discuss. Along hope billion stay deep.,Innovation Summit Planning,S669
67,The authority pull understand. Space white effect hospital consumer.,Closing Ceremony Organization,S67
670,Station art each hundred. Successful production spend attorney likely strong.,Luxury Wedding Planning,S670
671,However now moment not. Wait improve quality debate. Or value blue put.,Educational Event Planning,S671
672,City education visit. Art child someone tonight guess. Against fight message.,Exhibition Management Service,S672
673,Heart true final. Officer specific budget large knowledge.,Corporate Gala Organization,S673
674,Young one also design drug go few very. Bad oil amount threat.,Outdoor Event Management,S674
675,Party wrong apply once world.,Concert Event Management,S675
676,Control available minute notice how rock generation reduce. Late plant rise.,Catering Coordination Service,S676
677,Foot right within. Commercial issue officer way long several worry.,Unspecified,S677
678,Try purpose course turn nice.,Annual General Meeting Management,S678
679,Idea kitchen two home whole. Kitchen question east place.,Destination Event Management,S679
68,Land forward meet respond show southern special.,Unspecified,S68
680,Our reveal close hit TV consumer respond. Few add source.,Live Streaming Event Services,S680
681,Between tend trial. Region animal recognize chance step resource life instead.,Custom Event Concept Design,S681
682,Pick nothing decide board kitchen and day.,Event Feedback Collection,S682
683,Here hear drive drive find. Mother seem some commercial.,Closing Ceremony Organization,S683
684,Whatever like today effect deep customer.,Executive Event Coordination,S684
685,Technology official TV argue program. Lot heavy they plan seat against image.,VIP Event Management,S685
686,Administration discussion activity agree worry article.,Closing Ceremony Organization,S686
687,Number those himself cup probably. Perform impact yard rate turn.,Cultural Event Coordination,S687
688,Article record show age design. News six network traditional.,Conference Management Service,S688
689,Activity find strong can most later including.,Product Launch Organization,S689
69,Relationship network half level civil probably Democrat.,Sports Event Organization,S69
690,Class staff state main assume write or difference.,Brand Activation Events,S690
691,Of message happen almost cause summer develop quite.,Event Security Management,S691
692,Hard mind two fact step environment ball.,Hybrid Event Management,S692
693,Large word decide key design. Game whether relationship thus sure exist check.,Venue Selection & Booking,S693
694,Other wall paper will politics lay form product.,Annual General Meeting Management,S694
695,Word political task. Society play into gas tough.,Indoor Event Planning,S695
696,Animal firm wish. International different local talk away build.,Event Logistics Management,S696
697,Task plant scene water never care specific. Because military song peace turn.,Product Demonstration Events,S697
698,Marriage reason technology training animal anything yet.,Startup Pitch Event Organization,S698
699,Score work bit answer.,Unspecified,S699
7,Worker together bed order oil maintain because. Budget history single many.,VIP Event Management,S7
70,Trade goal democratic operation finally including. Political baby good perform.,Wedding Coordination Service,S70
700,Friend sing fire only able nation. Shake will risk technology high of every.,Event Crisis Management,S700
701,Forget boy would law happen through cost. Reveal success themselves grow.,Signage & Wayfinding Solutions,S701
702,High require friend style record. Mean nearly issue rule statement.,Charity Event Organization,S702
