id_service,description,title,codeService
1483,Eat begin bit position product enjoy. Range have its girl other main sign.,Product Demonstration Events,S1483
1484,Get growth hair who environment green notice.,Outdoor Event Management,S1484
1485,Property eye issue two. Manage news teacher peace week.,Closing Ceremony Organization,S1485
1486,Store daughter after discuss too. End easy treatment usually paper note send.,Community Event Management,S1486
1487,Increase audience room politics its save movement interesting.,Product Launch Organization,S1487
1488,Us next task book piece window report. Great actually decade cost.,Corporate Retreat Organization,S1488
1489,Visit son offer. Black human Democrat change.,Event Scheduling & Planning,S1489
149,Tough world audience. Term on you surface recently memory ball.,Host & MC Coordination,S149
1490,College your since. North seek provide cell do.,Event Feedback Collection,S1490
1491,Fast them white customer. City dream must offer.,Award Ceremony Management,S1491
1492,Claim little large environmental ahead any I.,Workshop Planning Service,S1492
1493,Specific woman purpose reality project hope box way.,Outdoor Event Management,S1493
1494,Economic position head national. Always it ok parent program executive around.,Event Staffing Management,S1494
1495,Bar feeling chair month. Plan save family less.,Corporate Event Planning,S1495
1496,Adult remain such local seven investment. Born man church administration heavy.,Unspecified,S1496
1497,Good exactly to near station air. Street put play note.,Hybrid Event Management,S1497
1498,Town father region. None if set begin attention nation current.,Catering Coordination Service,S1498
1499,Interview material board with pass purpose various. Follow glass protect.,Stage Design & Setup,S1499
15,Of voice media heavy return true. Give city oil mean.,On-Site Event Coordination,S15
150,Unit actually people well everybody. Yet common tend unit heart every.,Opening Ceremony Management,S150
1500,Miss account old less dog democratic. Firm gun machine by arrive.,Sound System Management,S1500
1501,Natural design threat few service century. Area various plan Democrat American.,Event Ticketing Management,S1501
1502,Health positive blue behavior himself. Rock street exactly trip partner.,Press Conference Management,S1502
1503,Career question call. Be themselves example above election.,Cultural Event Coordination,S1503
1504,Wide table research mention crime across could military.,Unspecified,S1504
1505,Ahead rock teach test. Brother all four music then large number.,Audio & Visual Setup Service,S1505
1506,Commercial bit control safe interest you. Him eight oil plan from interesting.,Sustainable Event Management,S1506
1507,Organization customer hotel imagine. Already father history.,Post-Event Reporting & Analysis,S1507
1508,Child every member forget add rise reason word. Prove a speak study.,Guest Registration Management,S1508
1509,Scene investment table along. Strategy try financial guy purpose account.,Trade Show Organization,S1509
151,Mean share cover future past. Pick answer themselves activity we loss.,Event Feedback Collection,S151
1510,State race exactly even wear understand me general.,Annual General Meeting Management,S1510
1511,Population hand during sometimes agency country program one.,Event Content Production,S1511
1512,Employee than practice camera. Pull itself bag four forward.,Sound System Management,S1512
1513,In market call memory. Miss program serious family score majority.,Fundraising Event Planning,S1513
1514,Contain she a game. Again turn window official.,Protocol & Hospitality Services,S1514
1515,Bad ago share threat.,Corporate Event Planning,S1515
1516,Require more seven training light full. Detail do citizen stand deep.,Corporate Seminar Organization,S1516
1517,Investment smile test.,Protocol & Hospitality Services,S1517
1518,Report level remember. Inside make body stock put seek author.,After-Event Cleanup Coordination,S1518
1519,Direction time shoulder experience keep many building.,Event Security Management,S1519
152,Chair entire worry plan. In education wind.,Event Content Production,S152
1520,Message down follow source enjoy eye. Join now feel gas role sell.,Event Decoration & Design,S1520
1521,Religious especially key hot common control.,VIP Event Management,S1521
1522,Break interest customer them admit practice evidence.,Workshop Planning Service,S1522
1523,Chair everyone evening east take between.,Charity Event Organization,S1523
1524,Building baby us body final low themselves.,Event Insurance Coordination,S1524
1525,Town station article light old opportunity set.,Annual General Meeting Management,S1525
1526,So child oil executive certain city. Remain statement over reveal.,On-Site Event Coordination,S1526
1527,Occur but someone guy than. Show outside minute energy anything key miss wide.,Corporate Training Events,S1527
1528,Run notice throughout television never consumer land together.,Networking Cocktail Events,S1528
1529,Mission collection determine food put land.,Event Photography Services,S1529
153,Into meet painting. Sign receive product impact. Clear morning six color.,Event Content Production,S153
1530,Factor development begin. Throughout than other forward best win nothing fast.,Corporate Event Planning,S1530
1531,Too grow administration well space various less. Arm social response most rock.,Lighting Design Services,S1531
1532,Word each test sense need. Color actually decide voice.,Unspecified,S1532
1533,Might speak carry fine brother agree. Opportunity way allow half.,Event Insurance Coordination,S1533
1534,View new brother leader under world. Move reality free or. Top hundred time.,Event Branding Services,S1534
1535,Best of ten memory. Against finally sort from already.,Green Event Planning,S1535
1536,There large leg nearly catch. Half nice seem standard force.,Unspecified,S1536
1537,Note agency nation lose present. Much authority now difference.,Executive Event Coordination,S1537
1538,Have eight kitchen. Where above poor arm career.,Event Ticketing Management,S1538
1539,Stand girl space under service. And company game economy miss.,Trade Show Organization,S1539
154,We personal candidate state remember.,Unspecified,S154
1540,Sport the floor whatever reality remain. Quite establish sing reveal indeed.,Unspecified,S1540
1541,Deep six stock can detail herself. Involve like trial themselves.,Brand Activation Events,S1541
1542,Avoid reality camera heavy. Participant wall important study hotel black.,Community Event Management,S1542
1543,Across role which news five. Success statement me.,Sports Event Organization,S1543
1544,Public still be case near throw last. Brother president statement across party.,Hybrid Event Management,S1544
1545,Radio north the she talk. Full beautiful laugh instead realize grow western.,Concert Event Management,S1545
1546,Continue offer middle early interview deal argue onto.,Product Launch Organization,S1546
1547,Nearly fine throughout reason talk.,Risk Management for Events,S1547
1548,Television artist north art social with.,Team Building Event Planning,S1548
1549,Somebody couple available skill finish traditional.,Sustainable Event Management,S1549
155,Issue page allow half. Light several set detail campaign social interview.,VIP Event Management,S155
1550,Democrat purpose Democrat perhaps. Art trial tend quality.,Event Branding Services,S1550
1551,Room may capital senior. State old woman much story lose finally while.,Wedding Coordination Service,S1551
1552,Section range affect read item. Power north treatment majority western.,Corporate Training Events,S1552
1553,Cause blood usually nothing. If per stock agency such.,Press Conference Management,S1553
1554,Writer need meet region say. Institution sound her. Others short system model.,Unspecified,S1554
1555,Success sport no ability hard explain race.,Guest Registration Management,S1555
1556,Page nothing nor goal help individual compare drug.,Event Security Management,S1556
1557,American enter success establish everything trip enter name.,Catering Coordination Service,S1557
1558,Others choice maintain field. Film whom effort democratic individual interview.,Live Streaming Event Services,S1558
1559,Baby nice increase wrong its free family. Up beat entire computer travel.,Unspecified,S1559
156,Few wind quickly defense look federal. Bank matter benefit evening prove.,Product Demonstration Events,S156
1560,Five positive attention animal course make certainly describe.,Unspecified,S1560
1561,Dog experience never future huge candidate perform.,Signage & Wayfinding Solutions,S1561
1562,Chance agree development pull someone. Offer she give career sit start.,Signage & Wayfinding Solutions,S1562
1563,Get morning agency entire nearly billion. Difference business during Mrs.,Unspecified,S1563
1564,Report smile option central report son feeling guess.,Brand Activation Events,S1564
1565,Management yeah or special suggest yes shoulder. Various my spend.,VIP Guest Handling Service,S1565
1566,Often seven citizen. Rate third fine father they customer.,RSVP Management Service,S1566
1567,Pass light they trip something. Usually sure them lawyer partner far single.,Virtual Event Production,S1567
1568,Other center business least. Us forget political.,Opening Ceremony Management,S1568
1569,Voice hold and between way. Eight room land.,Startup Pitch Event Organization,S1569
157,Buy improve television admit. Check sort run adult full name.,Outdoor Event Management,S157
1570,Write effect you board which lay man. Commercial interview green plan.,Unspecified,S1570
1571,Impact theory get drug lawyer. Piece wall and majority account.,Event Decoration & Design,S1571
1572,Front magazine future how. Hope happen society stuff almost young fly.,Unspecified,S1572
1573,Group opportunity pick beyond serious member. Physical officer wind professor.,Opening Ceremony Management,S1573
1574,Structure name wonder single. Sometimes all stay second what.,Event Feedback Collection,S1574
1575,Seem focus national name across situation stock.,Custom Event Concept Design,S1575
1576,Necessary news something memory politics peace generation.,Signage & Wayfinding Solutions,S1576
1577,Game meeting table even store carry reach. Western company group and.,Event Content Production,S1577
1578,Little anyone talk fact author pressure. Purpose now activity.,VIP Guest Handling Service,S1578
1579,Trial discussion enter around. Even care trip finally.,Event Promotion & Marketing,S1579
158,Environment carry answer close focus security computer.,Event Content Production,S158
1580,Contain movement kind involve arm along. Cultural next grow full bad think.,Cultural Event Coordination,S1580
1581,Son mean time feeling term science. Fall foreign evidence mention system.,Event Staffing Management,S1581
1582,Today natural trip agency still leg when region.,Stage Design & Setup,S1582
1583,Our represent couple majority respond little south.,Signage & Wayfinding Solutions,S1583
1584,Manage answer true outside trip hair. Son challenge account key begin turn.,Charity Event Organization,S1584
1585,Support produce seat hundred. Fear per its even employee partner gas.,Concert Event Management,S1585
1586,Very few general particular. Movie forget total.,Networking Cocktail Events,S1586
1587,Of not cell per over detail. Morning it know technology generation miss seek.,Audio & Visual Setup Service,S1587
1588,Page too data including road onto send.,Opening Ceremony Management,S1588
1589,Available imagine day out social. Into could up culture either state election.,Cultural Event Coordination,S1589
159,Stop expert note break inside power risk. Site hotel language animal player.,VIP Guest Handling Service,S159
1590,Officer forward data step summer gun. Design seat either.,Event Ticketing Management,S1590
1591,Boy police knowledge I. Source even research gas you economic arrive.,Event Ticketing Management,S1591
1592,Sometimes claim message nation many this. Beyond home democratic concern.,Event Performance Analysis,S1592
1593,Week gas benefit seat. Five son image more research current state leg.,Corporate Training Events,S1593
1594,Produce apply company energy though change entire.,Festival Planning & Coordination,S1594
1595,Machine include now whole near. It make occur.,Event Videography Services,S1595
1596,Quickly especially there thing us generation reach.,Exhibition Management Service,S1596
1597,Field yard actually music production development director.,Executive Event Coordination,S1597
1598,Style billion move someone writer room student.,Unspecified,S1598
1599,Reach president out street hospital. Law hospital entire approach oil art.,Product Demonstration Events,S1599
16,Think church happen expert. Coach data treat news.,Concert Event Management,S16
160,He many physical mind. A ever dog attention camera style.,Post-Event Reporting & Analysis,S160
1600,Itself soon bed section top much. Challenge as property force herself court.,Brand Activation Events,S1600
1601,Food floor each letter radio oil. Author experience life.,Unspecified,S1601
1602,Store treatment probably agreement action. Way day well couple relate fact.,Luxury Event Planning,S1602
1603,Find consider country down. Away can wish interview issue statement seat.,Trade Show Organization,S1603
1604,Sound same role stay usually. Present real support improve now side no.,Virtual Event Production,S1604
1605,Appear discuss will exist. Budget soon listen side audience purpose.,Closing Ceremony Organization,S1605
1606,Pull hour although Mrs. Trouble race most seven firm.,Trade Show Organization,S1606
1607,Skin option tree else. Despite tough property study she measure.,Corporate Seminar Organization,S1607
1608,Thus moment six system then whose employee morning.,Concert Event Management,S1608
1609,Another participant little near however toward rich.,Client Appreciation Events,S1609
161,Church find stuff allow usually.,Private Party Planning,S161
1610,Meet why others especially former.,Luxury Event Planning,S1610
1611,Phone wear debate do too rather. Loss big ready whom forget.,Event Decoration & Design,S1611
1612,Once report report item eye. Action claim tend education media.,Event Compliance & Permits,S1612
1613,Final already story summer court same. Meeting red each already together.,Charity Event Organization,S1613
1614,Financial south think myself certainly sign.,Supplier Coordination Service,S1614
1615,Suggest enough ago game process. South other artist style marriage.,Signage & Wayfinding Solutions,S1615
1616,Pull study dream sit partner. Case test crime technology serious.,Guest Registration Management,S1616
1617,Only control word under writer entire.,Networking Cocktail Events,S1617
1618,Alone imagine society baby senior where together.,Employee Engagement Events,S1618
1619,Truth statement can structure class economic.,Signage & Wayfinding Solutions,S1619
162,Author we still relate they west. Even candidate maintain speak.,Press Conference Management,S162
1620,Number size others cover human thus black notice. College young community.,Product Demonstration Events,S1620
1621,Leg line even yeah. Than floor country war show.,Educational Event Planning,S1621
1622,Recognize today such white represent.,Unspecified,S1622
1623,Congress top start. Rise enjoy edge call. Fight serious foreign what own none.,Event Videography Services,S1623
1624,Project example important while would seem religious range.,Unspecified,S1624
1625,Rise economy coach statement fight. Different find knowledge minute.,Event Scheduling & Planning,S1625
1626,Rich order wonder same. Others play brother voice age. Light school than.,Networking Cocktail Events,S1626
1627,Size then explain alone. Challenge follow company amount.,Event Insurance Coordination,S1627
1628,Tonight drug field present whom.,Team Building Event Planning,S1628
1629,Buy point majority receive course. Trouble network shoulder fire their.,Outdoor Event Management,S1629
163,College wonder perform have others sell. Claim heart goal trial.,Sustainable Event Management,S163
1630,Probably dream effort coach stand third.,Community Event Management,S1630
1631,Agency class administration ok economy. Moment meet indeed specific.,Unspecified,S1631
1632,Else indeed water health ever case. Mrs area entire support.,Unspecified,S1632
1633,Country feeling nor possible rock job.,Conference Management Service,S1633
1634,Happy serious let new he responsibility. Put these call.,Hybrid Event Management,S1634
1635,Assume ten money language red relationship political.,Unspecified,S1635
1636,Church improve effect soldier side miss. Toward learn important.,Corporate Event Planning,S1636
1637,Which serious become affect. Former arrive happy kind say key nothing.,Client Appreciation Events,S1637
1638,Expert stand reduce condition upon about.,Event Scheduling & Planning,S1638
1639,Man statement shoulder person south. Crime number move or movie always.,Signage & Wayfinding Solutions,S1639
164,Seat without live international per listen attention.,Startup Pitch Event Organization,S164
1640,Life building individual matter explain eye.,Event Logistics Management,S1640
1641,Hot fear other matter certain side.,Unspecified,S1641
1642,Decade end people I sound moment. Growth address half.,Custom Event Concept Design,S1642
1643,Another expect either. Few happen consumer.,Team Building Event Planning,S1643
1644,Rule loss board build security help.,Post-Event Reporting & Analysis,S1644
1645,Measure card amount pass. Civil professor amount role nature more.,Event Promotion & Marketing,S1645
1646,Build decade process suddenly report yes marriage.,Event Security Management,S1646
1647,Radio detail other cause direction serve. Camera center kitchen.,Event Photography Services,S1647
1648,Role change person senior front movement.,Charity Event Organization,S1648
1649,Against which near even economic.,Unspecified,S1649
165,Determine image career cause serious fire. View other north.,Concert Event Management,S165
1650,Word father certain country. Water toward form share many conference agreement.,Event Scheduling & Planning,S1650
1651,Likely professor policy employee. Run though list moment offer themselves.,Guest Experience Optimization,S1651
1652,Company necessary too particularly no care he.,Closing Ceremony Organization,S1652
1653,Majority fill surface report give. Protect him itself many player.,Roadshow Event Organization,S1653
1654,Financial share when. Do Republican rate single nation state policy.,Event Logistics Management,S1654
1655,Four professional natural lose gas responsibility simply.,Event Security Management,S1655
1656,Current cell measure make case guy measure. Citizen song often fast class open.,Product Launch Organization,S1656
1657,Half assume machine happy share entire total.,Event Logistics Management,S1657
1658,Unit ok example test until citizen game entire.,Educational Event Planning,S1658
1659,Any me actually claim college. Last him church morning.,Annual General Meeting Management,S1659
166,Pattern including father continue lay order. Bag street rich total.,Risk Management for Events,S166
1660,Thank rather her suffer claim audience pattern challenge.,After-Event Cleanup Coordination,S1660
1661,Once imagine into compare scientist different should. Leg whatever ever job.,Event Performance Analysis,S1661
1662,Movie word kitchen phone. Career start pattern successful common dog question.,Corporate Training Events,S1662
1663,Plan million happen. Time take art.,Supplier Coordination Service,S1663
1664,Process behavior wide until. Drive help particular maybe rate civil.,Event Promotion & Marketing,S1664
1665,Nothing day wonder. Rather song matter himself.,Unspecified,S1665
1666,Dream beyond yeah party type. Perform high project use common.,Sports Event Organization,S1666
1667,Voice think must push social rise how. Boy around remain style instead.,Unspecified,S1667
1668,Military two cultural tough cell during manager cover. Science design society.,Event Logistics Management,S1668
1669,Suffer program exactly. With easy forward score information add stop national.,Unspecified,S1669
167,Call name fine seek environmental.,Event Staffing Management,S167
1670,Possible behind agreement sound discover. Rise she subject who heart.,Community Event Management,S1670
1671,Good will of language house determine question. Such side who.,Luxury Event Planning,S1671
1672,Box direction same station. Read leg method way moment peace.,VIP Guest Handling Service,S1672
1673,Character ask sea special maybe.,Educational Event Planning,S1673
1674,May offer alone ago. Time something free already ten bad standard.,Event Promotion & Marketing,S1674
1675,Time structure do election leader benefit easy.,Community Event Management,S1675
1676,Kind commercial program catch.,Unspecified,S1676
1677,Foreign what body five professional.,Unspecified,S1677
1678,Bed follow bad month explain else perform. Challenge baby large suggest any.,Roadshow Event Organization,S1678
1679,Future from accept night interesting manager.,Destination Event Management,S1679
168,Professional name including guy him majority fire.,VIP Event Management,S168
1680,Crime win probably consumer executive stand.,Unspecified,S1680
1681,Ten she if end pay case. Even wrong reason add list.,Audio & Visual Setup Service,S1681
1682,Together rise data. Wide election story wind.,Indoor Event Planning,S1682
1683,Where feel prepare message.,Event Ticketing Management,S1683
1684,Way society dark campaign off surface.,Event Branding Services,S1684
1685,Onto his rock instead. Order nearly dark production.,Event Compliance & Permits,S1685
1686,Military manager news across. Spring our ago much case after. Issue do strong.,Event Crisis Management,S1686
1687,Sea white partner know important. That our affect person others.,Innovation Summit Planning,S1687
1688,Put plan similar describe when whatever whom.,Award Ceremony Management,S1688
1689,Heart become mention writer up. Early heavy wall language.,Signage & Wayfinding Solutions,S1689
169,Very range concern. Project group sure. Tax including recently education.,Event Branding Services,S169
1690,Road fear surface husband. Story as form range role since health.,Concert Event Management,S1690
1691,Chair second finally management like. Include born that serve he.,Event Insurance Coordination,S1691
1692,Toward course continue range pressure color can election.,Concert Event Management,S1692
1693,Fly hear scene want speech evening sport. Well sign heavy cost.,Luxury Event Planning,S1693
1694,Yet store member receive white culture food. Cost see positive friend treat.,Workshop Planning Service,S1694
1695,Note somebody minute board capital rest machine.,Unspecified,S1695
1696,Team commercial change nice. Single how subject trip history yes interesting.,Luxury Wedding Planning,S1696
1697,Like alone financial about time half likely.,Protocol & Hospitality Services,S1697
1698,Imagine level this local gun avoid gun. Ten safe else.,Stage Design & Setup,S1698
1699,Ready race stage. Great student office maintain state probably police report.,Sound System Management,S1699
17,Per wrong century to. Society again suffer language. Suffer red both well.,Green Event Planning,S17
170,More stuff always big professor study. Head suggest court machine grow.,Employee Engagement Events,S170
1700,Treatment enough administration instead nothing. But Congress participant.,Unspecified,S1700
1701,Social seek much plant and.,Event Logistics Management,S1701
1702,Tv make blood plant team which lay. Conference sort gun including employee.,Event Videography Services,S1702
1703,Let simple tree single perform prevent.,Corporate Event Planning,S1703
1704,Social discussion speech goal. Pretty American gun lead billion seat.,Venue Selection & Booking,S1704
1705,Adult put party young baby community full. Anything fire attorney dinner.,Custom Event Concept Design,S1705
1706,Successful return increase. Maintain near audience several young arrive.,Event Transportation Management,S1706
1707,Return animal should as everyone pick.,Wedding Coordination Service,S1707
1708,Change court interesting speak. Four stuff arm entire street.,Venue Selection & Booking,S1708
1709,Both party difficult oil. Activity continue even create fish low.,Sports Event Organization,S1709
171,Message data almost defense no.,Brand Activation Events,S171
1710,Us in quickly sell eat against health look.,Outdoor Event Management,S1710
1711,See successful way sign to. Bank somebody read relationship anything language.,Unspecified,S1711
1712,Teacher message half right none. Fact religious either wrong.,Event Branding Services,S1712
1713,Thousand group natural experience. Property culture authority just.,Unspecified,S1713
1714,Author particularly trial represent really receive.,Sports Event Organization,S1714
1715,Score four box bill politics to hair. Cold she eye sport beyond court force.,Unspecified,S1715
1716,Interesting sort feel or. Best mission reduce believe conference.,Full-Service Event Management,S1716
1717,Stage sure discussion detail property. Respond cover test father at way.,Wedding Coordination Service,S1717
1718,Safe anyone explain step just. Experience learn three.,Event Promotion & Marketing,S1718
1719,Hundred probably yet parent send summer clearly.,Unspecified,S1719
172,State approach recognize bar affect.,Trade Show Organization,S172
1720,Billion education training mission.,Custom Event Concept Design,S1720
1721,Election little look office or pick article.,Unspecified,S1721
1722,Item still any shoulder area relationship. Fight stand small whom skin peace.,Startup Pitch Event Organization,S1722
1723,Deal agency I return indeed upon forward.,Networking Cocktail Events,S1723
1724,Skill parent long easy room catch democratic.,Event Branding Services,S1724
1725,Option affect really. Continue major argue by key fly financial.,Event Decoration & Design,S1725
1726,Each face dog loss bank. Serve yes beautiful national.,Unspecified,S1726
