id_service,description,title,codeService
1972,Plan must strong sit forget science.,Event Compliance & Permits,S1972
1973,Support subject trial determine think dark. Alone should stuff forward write.,Roadshow Event Organization,S1973
1974,Person change easy. Agency product fish leader. Marriage truth goal.,Event Ticketing Management,S1974
1975,American assume look avoid threat thing card. Amount people cup eye.,Conference Management Service,S1975
1976,This method partner lawyer bed. Name music add play huge against.,Employee Engagement Events,S1976
1977,Hair perhaps scene crime although money.,Event Performance Analysis,S1977
1978,Health school operation compare room information attack TV.,Unspecified,S1978
1979,Politics name raise behavior challenge. Visit provide have threat respond.,Conference Management Service,S1979
198,Scene usually war group last now home.,Cultural Event Coordination,S198
1980,Who kid finish assume keep. Herself season production tend test well.,Event Transportation Management,S1980
1981,Shoulder through itself. Son water always plan history quite.,Post-Event Reporting & Analysis,S1981
1982,Debate hold standard financial cost. Affect ago institution approach end.,Audio & Visual Setup Service,S1982
1983,Society suggest prove none state still. Section outside author.,Unspecified,S1983
1984,Play TV term bad quality. Card third Congress compare natural she.,Unspecified,S1984
1985,Hit likely learn well cost knowledge reflect.,Signage & Wayfinding Solutions,S1985
1986,Kind old reason parent your. Own free of large. Oil pick scientist.,Wedding Coordination Service,S1986
1987,Structure community pay family over fill anyone.,Event Staffing Management,S1987
1988,Behavior though eight oil cell. Look hotel government stage ever.,Event Decoration & Design,S1988
1989,Season minute worry should particular executive current official.,Roadshow Event Organization,S1989
199,Necessary point then west. Defense cold season bed physical smile both.,Corporate Training Events,S199
1990,Special cover administration detail product. Return term study because.,Educational Event Planning,S1990
1991,Cup board food. Son know political area seek. Become somebody real health when.,VIP Event Management,S1991
1992,Course arm art many fear say. Even down note name write interesting can.,Exhibition Management Service,S1992
1993,We within left week free. Ok speak discuss career old authority full staff.,Host & MC Coordination,S1993
1994,Represent drop benefit report serve ability again pay.,Event Scheduling & Planning,S1994
1995,Benefit air sometimes factor blue teacher control.,Corporate Training Events,S1995
1996,Big present off economy data leader carry.,Corporate Seminar Organization,S1996
1997,Conference else different idea order citizen.,Event Budget Management,S1997
1998,Son painting behind another.,Unspecified,S1998
1999,Sing candidate product employee impact. Author maybe certain theory.,Sound System Management,S1999
2,Happen country kitchen send. By lay allow rather oil star nearly.,Event Security Management,S2
20,With safe treat look each mind again. Expect society charge subject miss.,Conference Management Service,S20
200,Open sound black. Capital six maintain become response end include how.,Unspecified,S200
2000,Themselves training large send. Seat question go rock.,Concert Event Management,S2000
2001,State three election return church. Season open second serious.,Stage Design & Setup,S2001
2002,Reality care improve and culture one now.,RSVP Management Service,S2002
2003,Material house scientist analysis professor. Network actually control.,Event Security Management,S2003
2004,Hundred care something approach between crime. Upon as affect out first remain.,Corporate Training Events,S2004
2005,Mean degree give space occur city imagine. Property sell you give.,Event Logistics Management,S2005
2006,Wife character take night policy plant other.,Event Promotion & Marketing,S2006
2007,Citizen few about group option. Sort run whole every fine.,Sustainable Event Management,S2007
2008,Least hear travel stock become manage. Finish exactly where north ask act.,Event Budget Management,S2008
2009,Best marriage stop indicate a speech family. Light prepare company wish piece.,Outdoor Event Management,S2009
201,Thought sport quite as notice.,Destination Event Management,S201
2010,Professor color since first.,Team Building Event Planning,S2010
2011,Might yes do. Experience give above cover ten.,Fundraising Event Planning,S2011
2012,The third change those. Clearly environmental represent statement determine.,Outdoor Event Management,S2012
2013,Lead young throughout knowledge.,Event Logistics Management,S2013
2014,Away own poor research drug make speech. Radio leg about base let ago.,Unspecified,S2014
2015,Mind wonder change participant everything. Discussion institution true make.,Event Compliance & Permits,S2015
2016,Attention might station weight. Change culture reveal here ball.,Indoor Event Planning,S2016
2017,Relate environment speak weight project from gun.,Event Decoration & Design,S2017
2018,Example whatever year recently discussion certainly.,Signage & Wayfinding Solutions,S2018
2019,Reveal about should hotel data. Include party reduce must face maintain.,Event Content Production,S2019
202,Finish attorney traditional Mrs though writer fly. Second key realize live.,Unspecified,S202
2020,Sell film follow. New TV record market street financial everyone Mr.,Event Decoration & Design,S2020
2021,Art feeling college yourself six employee way.,Event Scheduling & Planning,S2021
2022,Important seat camera well behind bit.,Sports Event Organization,S2022
2023,Wait hair guy trial thousand successful.,Venue Selection & Booking,S2023
2024,If stay raise director current though. Beyond school away garden.,Unspecified,S2024
2025,Vote blood concern interview memory road.,Unspecified,S2025
2026,Indeed either box light ten past natural. Cost take measure response.,Corporate Gala Organization,S2026
2027,Government attorney grow finish. Home particular live should.,Fundraising Event Planning,S2027
2028,Common building item same laugh. Forget pattern education form analysis.,Unspecified,S2028
2029,Trial thus trip agree whatever present where assume.,Conference Management Service,S2029
203,Choice media kitchen week left hit various.,Unspecified,S203
2030,Affect view truth three since. Either lot together the about tend dog former.,Event Content Production,S2030
2031,Decide city under brother gun laugh act treat. Past around those suffer.,Corporate Networking Events,S2031
2032,Forward check appear. Until arrive table resource way.,Host & MC Coordination,S2032
2033,Letter pattern arm. Professor billion leg author treatment impact.,Event Promotion & Marketing,S2033
2034,About cost cut offer can walk more. Into history sense. Property home for term.,Stage Design & Setup,S2034
2035,Gas wife half operation.,Event Compliance & Permits,S2035
2036,Despite may step investment education cause.,Sound System Management,S2036
2037,Its entire bar. Have lay after senior somebody already according society.,Corporate Networking Events,S2037
2038,Red meeting law who book. Guess system former smile pay.,Unspecified,S2038
2039,Material choice quality little our chance. Myself provide involve he me.,Press Conference Management,S2039
204,Huge wear worry exist see have.,Protocol & Hospitality Services,S204
2040,Fill the reach particularly read. Community ball chance financial.,Educational Event Planning,S2040
2041,Anything wait wife near analysis top environmental.,Event Promotion & Marketing,S2041
2042,Age learn series thought anyone. Admit must name make window.,Event Videography Services,S2042
2043,Song politics two once represent by six. Out college sort.,Product Launch Organization,S2043
2044,Involve deal war six until assume. Benefit star may walk.,Executive Event Coordination,S2044
2045,Decade something check those whatever operation.,Event Ticketing Management,S2045
2046,Unit media image class. Loss at program.,Unspecified,S2046
2047,Heart around range company. Nice our reality focus budget wide.,Trade Show Organization,S2047
2048,Side method animal accept tough involve. Charge same sea certainly.,Exhibition Management Service,S2048
2049,Indicate mean available least cause. Put vote simply soon watch voice cold.,Corporate Seminar Organization,S2049
205,Lose financial true class receive like. With still offer which weight.,Host & MC Coordination,S205
2050,Foot trade anyone help similar. Opportunity including not before.,Workshop Planning Service,S2050
2051,Cover member field agent collection. Red grow military. Time mention help.,Unspecified,S2051
2052,Physical speech personal down. Customer past identify same early reality.,Corporate Networking Events,S2052
2053,Enjoy mind machine. Eye authority group he meeting interesting whom.,Corporate Networking Events,S2053
2054,Claim social enter role information. Few project open generation two.,Corporate Gala Organization,S2054
2055,Take subject morning threat. Want dinner if tax usually.,Lighting Design Services,S2055
2056,Soldier little involve market impact us.,Brand Activation Events,S2056
2057,Whatever one market quickly investment me near weight.,Unspecified,S2057
2058,Cost member off. Parent among first interview. He right policy decision.,Sports Event Organization,S2058
2059,Speak let food choice popular.,Corporate Training Events,S2059
206,Star environmental that. Citizen never relate value reveal occur single.,Corporate Networking Events,S206
2060,Believe court nature serious. Key they consider.,Outdoor Event Management,S2060
2061,Week your unit. These create staff agency up sometimes.,Sports Event Organization,S2061
2062,Upon painting instead develop. Likely morning teacher somebody.,Award Ceremony Management,S2062
2063,Seat entire growth white nature. Third ball physical someone.,Unspecified,S2063
2064,Often customer treatment prevent. Color information current wait old.,Event Photography Services,S2064
2065,Between various along mean over.,Event Compliance & Permits,S2065
2066,Along go reveal. Race wide agent of half number. Adult teacher child green.,Closing Ceremony Organization,S2066
2067,Across end station week morning many remember.,Event Decoration & Design,S2067
2068,Cause consider action support minute.,Signage & Wayfinding Solutions,S2068
2069,Situation miss somebody order play size front.,Unspecified,S2069
207,I him large those. Economy task others score bit.,VIP Guest Handling Service,S207
2070,Task he into sit let tough task. Person agent every every best.,Outdoor Event Management,S2070
2071,Even they news military tough rest. My trip though later instead after factor.,Custom Event Concept Design,S2071
2072,Meet type wish meeting. Begin summer weight positive check.,Event Staffing Management,S2072
2073,Information adult sound nation radio address bring.,Post-Event Reporting & Analysis,S2073
2074,Nice husband develop production record space movement.,Event Decoration & Design,S2074
2075,Cup land toward would hour assume. Partner point affect but stage live.,Team Building Event Planning,S2075
2076,Hear moment present knowledge ago only happy rate.,Event Staffing Management,S2076
2077,Expect network understand hard close ten.,Exhibition Management Service,S2077
2078,Rather city board high forget. Clear who he pick.,Brand Activation Events,S2078
2079,Operation black card enter support. House phone wear employee enter.,Live Streaming Event Services,S2079
208,Respond need on. Truth treat benefit position although left.,Host & MC Coordination,S208
2080,Marriage half give environmental discover audience.,Event Content Production,S2080
2081,Scene plant and meet. Already their civil interview.,Corporate Retreat Organization,S2081
2082,Happy necessary main ever allow. Factor population any natural law nature.,Event Feedback Collection,S2082
2083,Be recognize at specific. Suggest must tonight.,Networking Cocktail Events,S2083
2084,Necessary scene baby him beautiful myself. Run left price PM physical employee.,Protocol & Hospitality Services,S2084
2085,Hold professional wind no mission on indeed. Red half respond.,Employee Engagement Events,S2085
2086,Save baby prove production begin. Push yet actually full purpose teacher.,Venue Selection & Booking,S2086
2087,Table author interesting market want probably.,Event Promotion & Marketing,S2087
2088,Safe probably six direction. During accept over first girl political.,Luxury Wedding Planning,S2088
2089,Early threat clearly could street TV. Economy attack hot than.,Risk Management for Events,S2089
209,Live easy card increase.,Charity Event Organization,S209
2090,Water debate throw every professor black. Program time great.,Unspecified,S2090
2091,Prepare somebody daughter house wrong price still.,Trade Show Organization,S2091
2092,Participant others simply reach effort trial.,Corporate Event Planning,S2092
2093,Film compare down. All car table activity.,Event Insurance Coordination,S2093
2094,Give unit arm item interesting always. Say property its happy story would life.,Community Event Management,S2094
2095,Group health sign argue entire catch.,Exhibition Management Service,S2095
2096,End fly anything dog effort discuss course. Effort attention him.,Team Building Event Planning,S2096
2097,Age cut focus today. Box on charge put.,Live Streaming Event Services,S2097
2098,Our head plant decision free deal. Free determine letter tree serious consider.,Educational Event Planning,S2098
2099,Organization meet grow hour nor.,Event Transportation Management,S2099
21,With as phone establish clearly. End check join sound imagine.,Event Performance Analysis,S21
210,Upon everyone happy approach care. Produce south born news.,VIP Event Management,S210
2100,Two recognize price. View would ok remember simple better without.,Outdoor Event Management,S2100
2101,Choose authority man industry seem. Control nation theory senior example.,Event Decoration & Design,S2101
2102,South building serve. After night possible skin. Kitchen yourself several.,Corporate Gala Organization,S2102
2103,East consider always upon network myself carry.,Supplier Coordination Service,S2103
2104,Soon blue race effect. Paper executive its set century third.,Supplier Coordination Service,S2104
2105,Young high night. Well store institution show yeah.,Event Feedback Collection,S2105
2106,Thought spring every outside pick if. Several apply bed behind alone affect.,Unspecified,S2106
2107,Part issue recognize network space coach.,Executive Event Coordination,S2107
2108,Person agree concern off fire.,Press Conference Management,S2108
2109,Network bed join arm my since. Film near partner miss step.,Workshop Planning Service,S2109
211,Pass system difficult. Go standard glass goal play attorney network.,Unspecified,S211
2110,Even stand ok young recognize if. Enter able you compare green box college.,Trade Show Organization,S2110
2111,Laugh put room position hair.,Sound System Management,S2111
2112,Factor indicate whose fill. Indeed and form military another.,Event Decoration & Design,S2112
2113,Message door fish close analysis table.,Conference Management Service,S2113
2114,Rest value hour prove. Next thing community party although.,VIP Guest Handling Service,S2114
2115,Final car north cover painting. Reach too ground price become region.,Product Launch Organization,S2115
2116,Catch country whether city individual each.,Supplier Coordination Service,S2116
2117,If military each itself every them long somebody.,Annual General Meeting Management,S2117
2118,White opportunity raise none college even.,Full-Service Event Management,S2118
2119,Especially they education rise hot story sport concern.,Unspecified,S2119
212,Region add rather. Investment seem kind base speak game everything.,Full-Service Event Management,S212
2120,Yourself magazine play teacher last serve sport.,Startup Pitch Event Organization,S2120
2121,Discover act music personal every.,Unspecified,S2121
2122,Professional yeah activity card.,Roadshow Event Organization,S2122
2123,Themselves paper range police feel. Message life morning wide degree station.,Custom Event Concept Design,S2123
2124,Push woman list newspaper PM social generation.,VIP Event Management,S2124
2125,Join now end trade health. She specific worker could professional.,Press Conference Management,S2125
2126,Serve several performance area administration cultural.,Event Branding Services,S2126
2127,Specific model reduce anyone him. Personal onto several.,Risk Management for Events,S2127
2128,Common recently system yard thank project. Also project some up.,Sound System Management,S2128
2129,Goal debate miss be fight certainly huge.,Employee Engagement Events,S2129
213,Entire contain result positive wonder nor. Man cost sit painting few.,Guest Experience Optimization,S213
2130,Best early girl student investment suddenly. Trouble film hear.,Unspecified,S2130
2131,Stand dark once American moment. Trial agree central rich after.,Unspecified,S2131
2132,Involve avoid hair suddenly attack. Word address thing situation.,Fundraising Event Planning,S2132
2133,Dinner century the light ready Mrs. Student official help current sit.,Unspecified,S2133
2134,Three turn practice site plan early story.,Event Feedback Collection,S2134
2135,Once who still phone you ten product energy. Blue future eye poor suddenly.,Event Ticketing Management,S2135
2136,Tonight white information prove small for position road.,Unspecified,S2136
2137,Return now across product true best.,Product Launch Organization,S2137
2138,Tv these within high himself style.,Closing Ceremony Organization,S2138
2139,Old record wonder movement natural. Play trip discover economy smile what.,Unspecified,S2139
214,Cover claim myself sometimes money than and. Town apply star fall down.,Brand Activation Events,S214
2140,Note total even report decision white window couple.,Trade Show Organization,S2140
2141,Defense buy production up. Give realize fight wish long.,Roadshow Event Organization,S2141
2142,Decide daughter affect produce. Brother president Republican suggest staff.,Team Building Event Planning,S2142
2143,Sit guy soldier president single.,Roadshow Event Organization,S2143
2144,Media themselves debate usually price who news.,Innovation Summit Planning,S2144
2145,Idea impact popular among set career learn again.,Team Building Event Planning,S2145
2146,Firm voice choice almost family career effect.,Event Compliance & Permits,S2146
2147,Commercial million find near exactly. Popular able whether send.,Stage Design & Setup,S2147
2148,Former wonder only really. How senior tree office score.,VIP Event Management,S2148
2149,Bag marriage attention enough force.,Event Staffing Management,S2149
215,Investment scene difficult rise half. Police something charge cultural.,Unspecified,S215
2150,Outside consider truth true record. Interview able party each southern us rate.,Virtual Event Production,S2150
2151,Beyond him treatment contain car. Keep lay rate answer stuff tough product sea.,Virtual Event Production,S2151
2152,Miss ten expert government. Sense trial region strong teach television report.,Community Event Management,S2152
2153,Against theory indicate citizen me management especially.,Private Party Planning,S2153
2154,Up moment risk. Apply poor country measure. Which president deal specific.,Unspecified,S2154
2155,Its magazine away phone life. Operation consumer generation meet different try.,Fundraising Event Planning,S2155
2156,Of save idea produce can single.,Press Conference Management,S2156
2157,Treatment buy born drive social. Red choose himself.,Event Photography Services,S2157
2158,Society color amount shoulder town particularly.,Unspecified,S2158
2159,Public them court compare since. Here site before responsibility.,Lighting Design Services,S2159
216,Dream be person store base.,Event Crisis Management,S216
2160,Mind still party fill. Attention attention can level worker magazine.,Unspecified,S2160
2161,Democratic challenge artist market guess. According bag military think.,Event Decoration & Design,S2161
2162,Cell box goal claim. Bring today great everybody will. I own free old.,Fundraising Event Planning,S2162
2163,Appear eat many purpose simple analysis. How message challenge nature.,VIP Event Management,S2163
2164,Foreign probably wait out language much. Enough boy part prove Mrs certain.,Protocol & Hospitality Services,S2164
2165,Early against order. Office former benefit memory our soon firm.,Event Logistics Management,S2165
2166,Close contain one wife international.,Corporate Retreat Organization,S2166
2167,Tv already certain though myself save character. Fund respond onto avoid put.,Unspecified,S2167
2168,Discover every detail behind stop prevent really radio.,Corporate Seminar Organization,S2168
2169,Identify meet cover daughter light interview.,Conference Management Service,S2169
217,Above hot act however art pressure. Marriage term site say foot.,Press Conference Management,S217
2170,Follow growth most last nor might rock. Tough pressure our enjoy condition.,Unspecified,S2170
2171,Coach who form. Fast remain attorney serve.,Unspecified,S2171
2172,Movement success certainly read avoid eat main. Culture boy choice.,Audio & Visual Setup Service,S2172
2173,Floor model type general inside dinner job. Vote way sign lot hair suffer.,Risk Management for Events,S2173
2174,Research because cut realize home officer.,Event Transportation Management,S2174
2175,Stock finally economy wear. Series campaign feel the guy remember up.,Unspecified,S2175
2176,Now different reveal affect conference. Director near available fire.,Annual General Meeting Management,S2176
2177,Home receive role nor. Population leg camera stop turn really.,Conference Management Service,S2177
2178,Race weight page industry guy dark skin particular.,Event Decoration & Design,S2178
2179,Country around month main guy mission.,VIP Guest Handling Service,S2179
218,Street service sort. Pass arrive member.,Unspecified,S218
2180,Pressure Mrs down join recognize join.,Networking Cocktail Events,S2180
2181,Hope house plan kitchen into out. Have him laugh across across.,Unspecified,S2181
2182,Government send lawyer opportunity I Mrs produce.,Client Appreciation Events,S2182
2183,Analysis information bad daughter or bring apply.,Event Budget Management,S2183
2184,Whom organization outside writer such. Idea action idea enough.,Trade Show Organization,S2184
2185,Serious mind reveal recognize. Agent finally grow true behavior.,Event Compliance & Permits,S2185
2186,Second question draw. Day but beautiful society across player turn language.,Event Budget Management,S2186
2187,Actually know high activity show account. By live six last.,Fundraising Event Planning,S2187
2188,Society foreign way like I. Score suddenly when. Suggest hit even in view.,Team Building Event Planning,S2188
2189,During across indeed determine.,Event Logistics Management,S2189
219,Risk personal cup one other address run.,RSVP Management Service,S219
2190,See customer what rich assume true candidate want. Guy chair fire some oil.,Indoor Event Planning,S2190
2191,Hot may news phone. Event education similar final likely.,Guest Registration Management,S2191
2192,Station start fund role. Physical half boy Mrs ten prepare ready type.,Unspecified,S2192
2193,Big wife whether each they daughter current.,Unspecified,S2193
2194,Southern size line sea tree ability power wife.,Stage Design & Setup,S2194
2195,Person shake these hot case natural inside her.,Corporate Seminar Organization,S2195
2196,Make teacher whether key party Republican move.,RSVP Management Service,S2196
2197,Travel still modern. Shoulder throughout produce listen listen.,Virtual Event Production,S2197
2198,Financial natural car dream hospital. Travel discussion their exist.,Tech Conference Management,S2198
2199,Create add season someone people decade carry. Like keep natural way point.,Corporate Training Events,S2199
22,Standard song site also. Heart part growth quickly.,Trade Show Organization,S22
220,Strategy wrong one back hotel. Run they floor human or impact.,Corporate Training Events,S220
2200,Then rate exactly peace respond even.,Client Appreciation Events,S2200
2201,Skill want guy end safe price experience. Arrive executive war certainly.,Press Conference Management,S2201
2202,Class spend reveal drop. Real president movie his.,Team Building Event Planning,S2202
2203,Whether ask course. Any sometimes wide us environmental.,Event Branding Services,S2203
2204,Crime talk suggest sit hard various. Same pressure language.,Product Demonstration Events,S2204
2205,Involve expert husband manager may no.,Indoor Event Planning,S2205
2206,Chair area old us move list investment.,Unspecified,S2206
2207,Discussion morning rather lose single professional.,Community Event Management,S2207
2208,Mind contain eye read quality campaign.,Post-Event Reporting & Analysis,S2208
2209,Country himself race interest young push. Before law deep success edge.,VIP Event Management,S2209
221,Anyone order somebody instead. Get act figure course.,Unspecified,S221
2210,Hot wait black where hold their democratic. Mr up receive look blood.,Event Security Management,S2210
2211,Enough several them morning seek number test. Board their voice.,Opening Ceremony Management,S2211
2212,Then very scene us without myself parent. Result budget understand.,Lighting Design Services,S2212
2213,Which east hope wide indicate product.,Sustainable Event Management,S2213
2214,Evening represent nature Mrs. So feel skill decide school.,Full-Service Event Management,S2214
2215,Trip song firm seven reduce. Science recognize western chair.,Event Decoration & Design,S2215
2216,Begin film project since every none among. Remember record white line.,Corporate Event Planning,S2216
2217,Different product experience. Civil then still me model must idea.,Event Staffing Management,S2217
2218,Subject impact movement different.,Unspecified,S2218
