id_service,description,title,codeService
1,Understand usually available experience program.,Brand Activation Events,S1
10,Leg among reach before. Alone professional approach cost company.,Unspecified,S10
100,Sometimes us teacher spend to. Factor help can.,Risk Management for Events,S100
1000,Leg here people great garden key.,Event Insurance Coordination,S1000
1001,Campaign open report. To PM try professional it to. Ball community house draw.,Green Event Planning,S1001
1002,Agency method central newspaper.,Hybrid Event Management,S1002
1003,Evidence item north phone. Recognize environment tell design ready.,Wedding Coordination Service,S1003
1004,Who black surface ever forget. Wind cell himself mind book suffer serve.,Exhibition Management Service,S1004
1005,Piece cost both lawyer it will. Course writer see soldier.,Event Logistics Management,S1005
1006,Shake event quite fly international information.,Green Event Planning,S1006
1007,Side alone prove true we official example. Next product employee itself.,Custom Event Concept Design,S1007
1008,Series wonder magazine finish experience sister.,Corporate Networking Events,S1008
1009,Successful animal fire believe daughter. Themselves sign outside foot.,Hybrid Event Management,S1009
101,Front at use young task boy move. Town rock one soldier thank.,Corporate Training Events,S101
1010,Money attack investment. Bring subject much suddenly defense meeting my money.,Sustainable Event Management,S1010
1011,Three article marriage develop can there friend.,Event Performance Analysis,S1011
1012,Right would receive system have every mind. Perhaps list argue close.,RSVP Management Service,S1012
1013,Worry order away often suffer plant away.,After-Event Cleanup Coordination,S1013
1014,Adult already then matter dinner. Phone why week education animal especially.,Concert Event Management,S1014
1015,World skin partner research must find professional maybe.,Community Event Management,S1015
1016,Technology form chair fast. Several fly young director decade.,Unspecified,S1016
1017,Listen reduce art business big fish could.,Event Videography Services,S1017
1018,Fine social likely. As parent loss though yes. Support wrong attack night.,Event Videography Services,S1018
1019,Culture color program coach. Year behavior table trial among until must.,Workshop Planning Service,S1019
102,Rise court interest daughter.,Innovation Summit Planning,S102
1020,Mouth condition exist by. May build another health else. Ok good walk imagine.,Unspecified,S1020
1021,Exactly another who future big improve through he.,Unspecified,S1021
1022,Join themselves analysis economy.,Event Videography Services,S1022
1023,Leave well natural with wait manager.,Event Decoration & Design,S1023
1024,Former hit purpose military. Meeting board he still article travel something.,Unspecified,S1024
1025,Seem public risk TV. Shoulder election shoulder daughter before reveal history.,Unspecified,S1025
1026,Financial natural trial anything area each.,Risk Management for Events,S1026
1027,Several how prepare his this sell rise. Discussion six act about.,Event Videography Services,S1027
1028,Or while door collection large peace hundred.,Unspecified,S1028
1029,Officer yard baby capital. Resource police back add model exactly word.,Opening Ceremony Management,S1029
103,Method answer show look figure information six practice.,Unspecified,S103
1030,Relationship star top. Project past voice type sing.,Guest Registration Management,S1030
1031,Finish free car business card. Card sort state data. Then media manager.,Unspecified,S1031
1032,Magazine contain guy season interest agency week.,Unspecified,S1032
1033,Finish determine themselves officer interview PM item.,Unspecified,S1033
1034,Window everybody movement security his.,Full-Service Event Management,S1034
1035,Vote manage product her forward economy daughter. He of country mention up.,Exhibition Management Service,S1035
1036,Letter dark according. Leader foot foot cup general beat. Read on then run.,Catering Coordination Service,S1036
1037,Drop religious lot. Feel for send whom finally. Small believe city tax.,Luxury Wedding Planning,S1037
1038,Large each public indicate. Church success our successful.,Event Branding Services,S1038
1039,Despite stand method if cut likely take reach.,Event Insurance Coordination,S1039
104,Debate glass development allow cell student. Sea fine role.,Tech Conference Management,S104
1040,Professor north energy nearly agreement lot. Also around deal free vote.,Unspecified,S1040
1041,Road book anything heavy candidate art.,Unspecified,S1041
1042,Imagine why international. Go fire body hair computer.,Unspecified,S1042
1043,Official western space between eight.,VIP Event Management,S1043
1044,Information which figure front. So time hotel compare officer town.,Unspecified,S1044
1045,Quickly result any. Pretty realize clearly tough half example allow.,Concert Event Management,S1045
1046,Mission allow month view offer religious claim laugh.,Guest Registration Management,S1046
1047,Wide even what once crime toward important. Story road play black.,Stage Design & Setup,S1047
1048,Leader determine visit. Research economy nature parent up.,Unspecified,S1048
1049,About life just soldier sign cover. Fact town seek without debate.,Opening Ceremony Management,S1049
105,Able quality upon great. Perhaps action build style church often.,Event Ticketing Management,S105
1050,Young collection increase. Security serious behind likely.,Team Building Event Planning,S1050
1051,Responsibility live concern ask trip. World account by serve ok reality.,Opening Ceremony Management,S1051
1052,Include always life thing. Song fine while if particularly.,Event Content Production,S1052
1053,Spring imagine other return likely.,VIP Event Management,S1053
1054,National marriage manager firm throw as its century.,Corporate Event Planning,S1054
1055,Enter star law top process traditional dark.,Sound System Management,S1055
1056,That commercial at ago. Be score six player control detail technology game.,Live Streaming Event Services,S1056
1057,Smile prepare particularly imagine notice.,Conference Management Service,S1057
1058,Article model ever arrive.,Risk Management for Events,S1058
1059,Design beat nature money phone stock live. At arrive and consumer break reason.,Unspecified,S1059
106,Road need certainly relationship. Water position human.,Corporate Retreat Organization,S106
1060,Rise he education decade second minute because.,Catering Coordination Service,S1060
1061,Set court war benefit man. Television close serious leg high mean so.,Green Event Planning,S1061
1062,Act player south possible happen. Development another make art across society.,Tech Conference Management,S1062
1063,Several number better onto year. Stay story than never appear save future.,Team Building Event Planning,S1063
1064,Blood note score within foreign.,Event Promotion & Marketing,S1064
1065,Parent surface political through. Become which few site practice whom although.,Exhibition Management Service,S1065
1066,Later camera summer team friend daughter agency.,Concert Event Management,S1066
1067,Early paper mind drop. Strong unit commercial do discover line.,Sustainable Event Management,S1067
1068,Nation home recent own analysis. Work scientist major theory.,Live Streaming Event Services,S1068
1069,Public return minute TV now experience. True woman travel wife cell.,Trade Show Organization,S1069
107,Director message avoid social seven wife.,Festival Planning & Coordination,S107
1070,Work it hotel surface me. Bring turn wide still agree.,Employee Engagement Events,S1070
1071,Law eye civil between. Shoulder personal actually act.,Unspecified,S1071
1072,Head rise citizen carry play. Wind account tough girl successful media.,Unspecified,S1072
1073,Movie improve tend manage. Thing four eat.,Community Event Management,S1073
1074,Service daughter because become. Citizen activity face long person.,Community Event Management,S1074
1075,Strong finally fear collection maybe. Upon article laugh hotel join beat.,Corporate Event Planning,S1075
1076,Reduce much common help use one expect.,Unspecified,S1076
1077,Forget development range. Impact kitchen from force. Around common could old.,Hybrid Event Management,S1077
1078,Approach note senior view up. Owner stop challenge down half better product.,Annual General Meeting Management,S1078
1079,Notice employee local election memory. Quality quite us employee talk.,Event Decoration & Design,S1079
108,Realize many against first international move.,Risk Management for Events,S108
1080,Rise property PM offer. Security much ago. Organization maintain walk carry.,Full-Service Event Management,S1080
1081,Summer home career hit law. Commercial blood ball those lose score.,Trade Show Organization,S1081
1082,Senior thus you discuss class then wonder. Front participant method final.,Unspecified,S1082
1083,Next about rest walk rise. Popular picture chance certain think change.,Employee Engagement Events,S1083
1084,Still best seven hot issue. Population one none place born.,Event Promotion & Marketing,S1084
1085,Trial street threat fund machine wrong.,Stage Design & Setup,S1085
1086,Recent event system present act man. Those sit between cut enough.,Sustainable Event Management,S1086
1087,Allow yeah magazine she. While add moment Congress popular.,Unspecified,S1087
1088,Eight between attention radio between effect worry.,Innovation Summit Planning,S1088
1089,Production shake realize miss happy pull change.,Corporate Networking Events,S1089
109,Pretty head nice interesting. Mrs take say institution behavior design author.,Unspecified,S109
1090,Play tax low eight. Discuss your writer forget personal turn.,Event Videography Services,S1090
1091,Assume figure PM manage economy low. Also ground local prove choose.,Corporate Training Events,S1091
1092,Gas economy win price air reality. The activity partner citizen.,On-Site Event Coordination,S1092
1093,Kitchen far another. National unit reveal lead. Let institution store.,Event Transportation Management,S1093
1094,Such other can word. People his executive short. None program modern.,Award Ceremony Management,S1094
1095,Usually stand parent century.,Product Launch Organization,S1095
1096,Describe school rest year nearly customer. Success summer respond choice.,Corporate Seminar Organization,S1096
1097,Gun sing by. Television be expect eight concern development expect.,Protocol & Hospitality Services,S1097
1098,Easy nature alone represent. Special shoulder tax everybody rather break chair.,Unspecified,S1098
1099,Plan although agree from enough offer coach. Reflect mind condition break.,Event Promotion & Marketing,S1099
11,Head third wait after thus discussion. Make water establish drop nothing.,Conference Management Service,S11
110,Camera late anything pick itself happen finally along.,Host & MC Coordination,S110
1100,By security respond. Fly rise police future. At soon reveal music experience.,Charity Event Organization,S1100
1101,Hour without like interest goal lot. High trouble player.,Unspecified,S1101
1102,Father while wear head conference into. Arm spend measure full central life.,Audio & Visual Setup Service,S1102
1103,Cut forward kitchen. Step hotel focus time attack size.,Corporate Gala Organization,S1103
1104,Five leader already seek word fly.,VIP Event Management,S1104
1105,Never media will prevent production television camera. Statement even bar.,Unspecified,S1105
1106,Any big shake smile recognize. Hospital firm show sound big.,Corporate Training Events,S1106
1107,Door center per old sound city yourself. Congress treat on pretty perform.,Post-Event Reporting & Analysis,S1107
1108,State conference behind have care movie.,Press Conference Management,S1108
1109,Side teacher hospital fall able assume sign.,Brand Activation Events,S1109
111,Ground finally song option. Fact will name itself.,Destination Event Management,S111
1110,Institution must foreign respond southern want everyone with.,Hybrid Event Management,S1110
1111,Relationship player serve mention draw. Wait fight hit such major author.,Team Building Event Planning,S1111
1112,Indeed without theory. Enter guess smile story perhaps somebody.,RSVP Management Service,S1112
1113,Life win against sort daughter level land happen. Much remain company.,Unspecified,S1113
1114,Recent speech visit show forget national adult win.,Sports Event Organization,S1114
1115,Write physical time information clearly issue blue begin.,Fundraising Event Planning,S1115
1116,Movement recently cell old body community institution.,Supplier Coordination Service,S1116
1117,Accept couple no them certain marriage their.,Tech Conference Management,S1117
1118,Enter often become sister. Food cause I draw.,Award Ceremony Management,S1118
1119,Window bag officer reality word laugh court. Month agreement far eat.,Post-Event Reporting & Analysis,S1119
112,Prevent less beautiful change wife fear fly issue. Have exist do measure.,Audio & Visual Setup Service,S112
1120,Pretty eat sort eight argue bill stay image. Reduce day rise store.,Unspecified,S1120
1121,Tough able build let couple hear security financial. Deal exactly to board.,Conference Management Service,S1121
1122,Seat main also. Provide mission ready because feeling range although party.,Unspecified,S1122
1123,Even maybe think another health. Join pressure knowledge tree white.,Workshop Planning Service,S1123
1124,North agency week develop. Contain when check reality design near participant.,Unspecified,S1124
1125,Example cold body response energy visit.,Team Building Event Planning,S1125
1126,Owner raise of grow short hear. Pm young always serve. Not vote remain lawyer.,Unspecified,S1126
1127,Small voice enter activity cause purpose. Situation two art work choice.,Sound System Management,S1127
1128,Someone doctor source attention charge join yeah allow.,Innovation Summit Planning,S1128
1129,Debate successful site go. Determine bag blue move.,VIP Guest Handling Service,S1129
113,Often yet television. Share painting black foreign claim shake policy majority.,Brand Activation Events,S113
1130,Especially indeed face kid. Significant remain act space station list.,Unspecified,S1130
1131,Whole project wind structure. Air fire describe president have.,VIP Guest Handling Service,S1131
1132,Military seat wonder half. Or training paper foot.,Corporate Networking Events,S1132
1133,Decide other same they partner product human.,Event Branding Services,S1133
1134,Music work space mouth within particularly he.,Unspecified,S1134
1135,Music show wonder catch free. Enter so art direction own.,Unspecified,S1135
1136,Yourself consider enter force. Life some seat. Test culture player.,Host & MC Coordination,S1136
1137,Still sit husband them bit TV garden. Run describe bank if.,Full-Service Event Management,S1137
1138,Dog concern stuff right final side. Difficult yet foot easy every lot.,Event Content Production,S1138
1139,Fear parent rock section interest. Part start be news exist.,Team Building Event Planning,S1139
114,Center little recognize life wonder.,Event Decoration & Design,S114
1140,Main staff old. Strategy land small thing.,Corporate Seminar Organization,S1140
1141,Season teacher get election heavy police have.,Private Party Planning,S1141
1142,Far keep product instead whom year everyone return.,Guest Registration Management,S1142
1143,Country or black picture. Most again thus laugh something spend include.,Award Ceremony Management,S1143
1144,Different gas carry possible throw care such.,Protocol & Hospitality Services,S1144
1145,Site Mr painting push although. Audience whom condition rather drive director.,Unspecified,S1145
1146,Deal word store guy. Sea gun check.,Executive Event Coordination,S1146
1147,Human son ready standard score finish.,Full-Service Event Management,S1147
1148,Site protect off believe traditional answer of.,Product Launch Organization,S1148
1149,Bill support stock product. Among rich these hospital.,Executive Event Coordination,S1149
115,College yourself girl take meeting. Box store claim fight.,Unspecified,S115
1150,Tv record minute produce investment value.,Corporate Retreat Organization,S1150
1151,Possible tend public capital. Student under building quickly their moment cost.,Supplier Coordination Service,S1151
1152,Plan drop call rock. Trouble view authority team who economic family purpose.,Virtual Event Production,S1152
1153,Cup middle bed stage still. Quality others remain kitchen.,Event Decoration & Design,S1153
1154,Face matter hope organization report wind me again.,Event Crisis Management,S1154
1155,Machine popular economic break wrong clearly author.,Client Appreciation Events,S1155
1156,Meet vote government worry court hope blue. Decision discuss focus especially.,Award Ceremony Management,S1156
1157,Look save lay still take situation happy. Pm option hundred.,Unspecified,S1157
1158,Fear meeting effort. Court bill daughter agree model just natural.,Charity Event Organization,S1158
1159,Leave figure red collection notice.,Event Staffing Management,S1159
116,Pass situation change choice already.,Indoor Event Planning,S116
1160,Bar move consider side prepare.,Event Branding Services,S1160
1161,General least glass good threat could range.,Concert Event Management,S1161
1162,Size begin win score letter mean former.,Sustainable Event Management,S1162
1163,Majority popular husband somebody management wonder just whole.,Sound System Management,S1163
1164,Car affect occur PM. Occur manager focus safe economic foreign.,Community Event Management,S1164
1165,Memory ok power series attorney here discuss.,VIP Guest Handling Service,S1165
1166,Book exist method affect product. Especially produce director image house.,Unspecified,S1166
1167,Avoid final claim. Attack whose couple future interest himself Congress.,Event Staffing Management,S1167
1168,Yet sport message pass alone. Benefit sometimes officer deep.,Protocol & Hospitality Services,S1168
1169,Full phone wife question let. Leave blue decade necessary note ago television.,Event Decoration & Design,S1169
117,Center energy candidate factor magazine until simple financial.,On-Site Event Coordination,S117
1170,Factor top town resource. Keep remember population financial.,Workshop Planning Service,S1170
1171,Thing image relationship which everyone.,Closing Ceremony Organization,S1171
1172,Number coach region medical. Government because remember. Wish reduce often.,Concert Event Management,S1172
1173,General keep across free once light man majority.,Workshop Planning Service,S1173
1174,Crime general win month. Office could question but speak how.,Cultural Event Coordination,S1174
1175,Collection adult professional question deal source.,Live Streaming Event Services,S1175
1176,Act money attention soldier approach yourself.,Client Appreciation Events,S1176
1177,Just seem benefit again enjoy respond.,Custom Event Concept Design,S1177
1178,Moment whole part improve play. Sign blood training these on.,Corporate Retreat Organization,S1178
1179,Nation moment age allow. National agent resource parent. Value thing short.,Startup Pitch Event Organization,S1179
118,Card about affect source get upon. Whom space message fall rate everyone.,Press Conference Management,S118
1180,Seem figure take after fill campaign. Difficult nation wear.,Catering Coordination Service,S1180
1181,Past political control east inside he. Table of admit summer.,Event Logistics Management,S1181
1182,Win class morning result by. How music finally camera.,Corporate Retreat Organization,S1182
1183,Area might employee ball answer may try. White might at page too.,Event Photography Services,S1183
1184,Dinner else material carry prepare according. Though others leader player.,Event Photography Services,S1184
1185,Page bank detail describe seven fast compare describe.,Sound System Management,S1185
1186,Reflect begin receive study thousand girl. Clearly spring him.,Custom Event Concept Design,S1186
1187,Pass cultural natural argue. Painting defense happy on later.,Product Demonstration Events,S1187
1188,Choice east plan statement alone growth. Whole personal show purpose.,Unspecified,S1188
1189,New possible may people board important particular.,RSVP Management Service,S1189
119,Create rule shake human price beautiful debate.,Private Party Planning,S119
1190,Week music pattern article why order treatment.,Sports Event Organization,S1190
1191,Field every expect TV no. Find appear will box both available away minute.,Unspecified,S1191
1192,It step quite. Choose also into you. Lay boy much answer.,Team Building Event Planning,S1192
1193,Every shake much not book. Throw town pick experience just trip.,Concert Event Management,S1193
1194,American which specific reveal better. Challenge sit from those skill where.,Festival Planning & Coordination,S1194
1195,Deep top direction party. Dog nor his city common also.,Lighting Design Services,S1195
1196,Example treatment gun from. Lead kitchen year yard worry.,Event Photography Services,S1196
1197,Foot determine thought upon. Cover head hit PM total.,Guest Registration Management,S1197
1198,Agent ahead wall gas generation into.,Tech Conference Management,S1198
1199,Red bag indicate cause Congress involve walk over. Huge argue discuss life.,VIP Guest Handling Service,S1199
12,May manager card since. Leave last item wife spend wrong we.,Annual General Meeting Management,S12
120,City strong democratic they peace.,VIP Event Management,S120
1200,Inside generation physical fine rise board. Go however Mrs employee.,Wedding Coordination Service,S1200
1201,Rock son late big see the. May family that my because though defense.,Full-Service Event Management,S1201
1202,Street choose lawyer detail term. Assume employee push.,Client Appreciation Events,S1202
1203,Trip star deal. Pm may thought sing.,Unspecified,S1203
1204,Or free finally theory find. End interview born might action east maybe.,Closing Ceremony Organization,S1204
1205,Physical suddenly head sea store least purpose computer.,Charity Event Organization,S1205
1206,Serve most play environmental. Medical today task off before address effect.,Guest Experience Optimization,S1206
1207,Drug explain decade say. Kid machine another exactly.,Hybrid Event Management,S1207
1208,Current factor outside low face. Pretty skin writer lay structure we.,Event Promotion & Marketing,S1208
1209,Parent rule performance when system.,Hybrid Event Management,S1209
121,Ability watch next simple we my. Challenge big because personal Mr white.,Team Building Event Planning,S121
1210,Until religious child employee firm could make.,Event Photography Services,S1210
1211,Ready building near soon do bed medical. Station apply impact third gas.,Unspecified,S1211
1212,Collection be may however coach case into. Medical partner source.,Unspecified,S1212
1213,Girl identify worry national might.,Virtual Event Production,S1213
1214,News adult American. Relationship today ground find body avoid population.,Event Photography Services,S1214
1215,Suddenly difference notice under everybody effect.,Workshop Planning Service,S1215
1216,Clearly just record agency easy. Wide produce and break concern.,Trade Show Organization,S1216
1217,Only success matter. Purpose find age less while.,Event Videography Services,S1217
1218,Certainly none just assume to. Major respond away.,Corporate Seminar Organization,S1218
1219,Away only alone eat mean. Life part low some southern might heavy.,Destination Event Management,S1219
122,Include bank part manager stand include green sea.,Unspecified,S122
1220,Natural improve dream back place fact. Of turn wrong see western.,Sustainable Event Management,S1220
1221,Pick upon account draw instead place sport training.,Innovation Summit Planning,S1221
1222,Choice store boy born throughout continue consumer.,Event Photography Services,S1222
1223,Decade among player whom. Plant night conference. She together center action.,Venue Selection & Booking,S1223
1224,Phone wish place. Medical few appear side fall field. Building face commercial.,Event Logistics Management,S1224
1225,Really stop significant detail head however father around.,Unspecified,S1225
1226,System positive anyone. Store growth throughout above other my.,Event Compliance & Permits,S1226
1227,Eat new expect our term capital. Peace test on more impact.,Tech Conference Management,S1227
1228,Whole campaign blue small face point. Former seem behind political claim cell.,Corporate Gala Organization,S1228
1229,Attention total draw pull together surface admit.,Charity Event Organization,S1229
123,Produce may guy. Student executive indeed road.,Cultural Event Coordination,S123
1230,Remember if discover film compare wait. Eat position rate one onto speak.,Stage Design & Setup,S1230
1231,Not personal idea himself program. Activity hair star more strategy art.,Event Performance Analysis,S1231
1232,Vote myself this goal perform. Dinner hit walk behind herself.,Corporate Training Events,S1232
1233,Military grow central other else. Today program finish seat matter society.,Corporate Training Events,S1233
1234,Weight them leader yeah. Serve window attorney difficult.,Guest Experience Optimization,S1234
1235,Involve garden sit factor. Benefit positive fear over safe.,Venue Selection & Booking,S1235
1236,Exist decide someone by answer than large.,Corporate Networking Events,S1236
1237,Whether create hope hit set science apply.,Event Content Production,S1237
1238,Plan finish media draw pass blood campaign difficult.,Unspecified,S1238
1239,Lead employee reveal effect property control product.,VIP Event Management,S1239
124,Tough measure fill he. Ready resource word next firm each.,Team Building Event Planning,S124
1240,Economy each lead laugh number opportunity. Author out four quality involve.,Post-Event Reporting & Analysis,S1240
1241,Policy support open present. News stay mouth foreign own participant.,Indoor Event Planning,S1241
1242,Police knowledge himself visit term stock mission if.,Event Branding Services,S1242
